{
    "name": "Wedge Ship Mk2",
    "filename": "geometry.mesh",
    "tags": [
        "ship",
        "vehicle",
        "spacecraft",
        "improved"
    ],
    "description": "An improved version of the wedge-shaped spacecraft with enhanced proportions",
    "mtl": "material.mtl",
    "texture": "texture.png"
}